{
  "$schema": "./schemas/opencode.schema.json",
  "instructions": ["AGENTS.md", "docs/**/*.md"],
  "permission": {
    "bash": {
      "deny": [
        "rm -rf /",
        "rm -rf /*",
        "rm -rf ~",
        "rm -rf /home",
        "rm -rf /home/*",
        "rm -rf /opt",
        "rm -rf /opt/*",
        "rm -rf /var",
        "rm -rf /var/*",
        "rm -rf /etc",
        "rm -rf /etc/*",
        "del /f /s /q C:\\Windows*",
        "del /f /s /q C:\\Program Files*",
        "del /f /s /q C:\\ProgramData*",
        "del /f /s /q C:\\Users\\*",
        "del /f /s /q C:\\*",
        "format C:*",
        "format *:",
        "mkfs*",
        "dd if=* of=/dev/sd*",
        "> /dev/sd*",
        "reg delete HKLM*",
        "reg delete HKCR*",
        "git push --force origin master",
        "git push --force origin main",
        "git push -f origin master",
        "git push -f origin main",
        "git reset --hard origin/master",
        "git reset --hard origin/main",
        "git clean -fdx*",
        ":(){:|:&};:"
      ]
    }
  },
  "agent": {
    "backend-engineer": {
      "mode": "subagent",
      "prompt": "You are a senior backend engineer specializing in server-side architecture, API design, database integration, and high-throughput systems. Build reliable, scalable services. Follow these standards: All API endpoints must have request/response schemas documented. Use parameterized queries exclusively. Implement proper HTTP status codes. Services must be stateless. Log all external service calls with latency and status code. Database migrations must be backwards-compatible.",
      "tools": ["read", "write", "edit", "bash", "glob", "grep"]
    },
    "frontend-engineer": {
      "mode": "subagent",
      "prompt": "You are a senior frontend engineer specializing in React, Next.js, TypeScript, and modern CSS. Build performant, accessible user interfaces. Follow these standards: Use functional components with hooks. Implement proper error boundaries. Optimize bundle size. Follow WCAG accessibility guidelines. Use TypeScript strict mode. Write integration tests for critical user flows.",
      "tools": ["read", "write", "edit", "bash", "glob", "grep"]
    },
    "security-engineer": {
      "mode": "subagent",
      "prompt": "You are a senior security engineer specializing in application security, penetration testing, and secure coding practices. Audit and secure applications. Follow these standards: Never hardcode secrets. Use parameterized queries. Implement proper authentication and authorization. Follow OWASP Top 10 guidelines. Encrypt sensitive data at rest and in transit. Log security-relevant events.",
      "tools": ["read", "write", "edit", "bash", "glob", "grep"]
    },
    "database-architect": {
      "mode": "subagent",
      "prompt": "You are a senior database architect specializing in schema design, query optimization, and data modeling. Design efficient, scalable database schemas. Follow these standards: Normalize to 3NF unless performance requires denormalization. Create indexes for frequent queries. Use foreign keys for referential integrity. Write backwards-compatible migrations. Document schema decisions.",
      "tools": ["read", "write", "edit", "bash", "glob", "grep"]
    },
    "devops-engineer": {
      "mode": "subagent",
      "prompt": "You are a senior DevOps engineer specializing in CI/CD, containerization, and infrastructure automation. Build reliable deployment pipelines. Follow these standards: Use infrastructure as code. Implement automated testing in CI. Containerize applications. Monitor health and performance. Implement rollback procedures. Document runbooks.",
      "tools": ["read", "write", "edit", "bash", "glob", "grep"]
    },
    "principal-engineer": {
      "mode": "subagent",
      "prompt": "You are a principal engineer specializing in system architecture, code review, and technical leadership. Make high-level technical decisions. Follow these standards: Consider scalability, maintainability, and security. Document architectural decisions. Review code for correctness and quality. Mentor team members. Avoid over-engineering.",
      "tools": ["read", "write", "edit", "bash", "glob", "grep"]
    },
    "debugger": {
      "mode": "subagent",
      "prompt": "You are a senior debugger specializing in root cause analysis, troubleshooting, and fixing complex bugs. Debug systematically. Follow these standards: Reproduce the issue first. Form hypotheses. Test hypotheses methodically. Fix root causes, not symptoms. Write regression tests. Document findings.",
      "tools": ["read", "bash", "glob", "grep"]
    },
    "ai-engineer": {
      "mode": "subagent",
      "prompt": "You are a senior AI engineer specializing in LLMs, embeddings, RAG systems, and machine learning pipelines. Build production AI systems. Follow these standards: Evaluate model performance. Implement proper error handling. Monitor drift and quality. Document model decisions. Consider cost and latency.",
      "tools": ["read", "write", "edit", "bash", "glob", "grep"]
    }
  },
  "command": {
    "security-audit": {
      "prompt": "Load the auto-router skill, detect intent for this request, then load the workflow-engine skill and execute the security-audit workflow step by step. Ask for required parameters (TARGET, SCOPE) if not provided.",
      "agent": "security-engineer"
    },
    "api-design": {
      "prompt": "Load the auto-router skill, detect intent for this request, then load the workflow-engine skill and execute the api-design workflow step by step. Ask for required parameters if not provided.",
      "agent": "backend-engineer"
    },
    "debug": {
      "prompt": "Load the auto-router skill, detect intent for this request, then load the workflow-engine skill and execute the debug-session workflow step by step. Ask for required parameters if not provided.",
      "agent": "debugger"
    },
    "review": {
      "prompt": "Load the auto-router skill, detect intent for this request, then load the workflow-engine skill and execute the code-review workflow step by step. Ask for required parameters if not provided.",
      "agent": "principal-engineer"
    },
    "optimize": {
      "prompt": "Load the auto-router skill, detect intent for this request, then load the workflow-engine skill and execute the performance-audit workflow step by step. Ask for required parameters if not provided.",
      "agent": "principal-engineer"
    },
    "build": {
      "prompt": "Load the command-builder skill and scaffold the requested component. Determine component type (agent, skill, workflow, command) from the request.",
      "agent": "backend-engineer"
    }
  },
  "mcp_servers": {
    "filesystem": {
      "transport": "stdio",
      "command": "npx",
      "args": ["-y", "@modelcontextprotocol/server-filesystem", "."],
      "category": "core",
      "skills_description": "Read, write, and list files in the project. Wraps the official Anthropic MCP filesystem server as a CogniVect skill so any agent can opt in."
    },
    "github": {
      "transport": "stdio",
      "command": "npx",
      "args": ["-y", "@modelcontextprotocol/server-github"],
      "env": { "GITHUB_PERSONAL_ACCESS_TOKEN": "${env:GITHUB_TOKEN}" },
      "category": "devops",
      "skills_description": "Interact with GitHub repositories, issues, and pull requests from inside a GOD-OPENCODE session."
    },
    "playwright": {
      "transport": "stdio",
      "command": "npx",
      "args": ["-y", "@playwright/mcp@latest"],
      "category": "testing",
      "skills_description": "Drive a real browser for end-to-end testing and live debugging. Uses the Playwright MCP server."
    },
    "context7": {
      "transport": "http",
      "url": "https://mcp.context7.com/mcp",
      "category": "ai",
      "skills_description": "Pull up-to-date third-party library documentation into agent context via the Context7 HTTP MCP endpoint."
    },
    "tavily": {
      "transport": "http",
      "url": "https://mcp.tavily.com/mcp",
      "headers": { "Authorization": "Bearer ${env:TAVILY_API_KEY}" },
      "category": "ai",
      "skills_description": "Web search and content extraction via Tavily. Useful for research workflows that need fresh web sources."
    }
  }
}
